{
  "version": "v1",
  "name": "diagnostic_update_response_prompt_baseline",
  "context_placeholder": "{{json_context}}",
  "required_placeholders": [
    "json_context"
  ],
  "policy_constraints": [
    "return strict JSON only",
    "do not claim final root cause",
    "give exactly one next check",
    "state uncertainty when evidence is not unique"
  ],
  "response_schema": {
    "type": "object",
    "additionalProperties": false,
    "required": [
      "problem_understanding",
      "similar_practical_context",
      "hypotheses",
      "first_check",
      "result_interpretation",
      "competing_interpretation"
    ],
    "properties": {
      "problem_understanding": {
        "type": "string"
      },
      "similar_practical_context": {
        "type": "string"
      },
      "hypotheses": {
        "type": "array",
        "minItems": 2,
        "maxItems": 3,
        "items": {
          "type": "object",
          "additionalProperties": false,
          "required": [
            "id",
            "text",
            "status",
            "rejection_reason",
            "source",
            "confidence"
          ],
          "properties": {
            "id": {
              "type": "string",
              "minLength": 1
            },
            "text": {
              "type": "string",
              "minLength": 1
            },
            "status": {
              "type": "string",
              "enum": [
                "active",
                "weakened",
                "rejected"
              ]
            },
            "rejection_reason": {
              "type": [
                "string",
                "null"
              ]
            },
            "source": {
              "type": "string",
              "enum": [
                "primary_incident",
                "alternative_context",
                "theory_mechanism"
              ]
            },
            "confidence": {
              "type": "string",
              "enum": [
                "low",
                "medium",
                "high"
              ]
            }
          }
        }
      },
      "first_check": {
        "type": "string"
      },
      "result_interpretation": {
        "type": "object",
        "additionalProperties": false,
        "required": [
          "supports_primary_if",
          "supports_competing_if",
          "inconclusive_if"
        ],
        "properties": {
          "supports_primary_if": {
            "type": "string"
          },
          "supports_competing_if": {
            "type": "string"
          },
          "inconclusive_if": {
            "type": [
              "string",
              "null"
            ]
          }
        }
      },
      "competing_interpretation": {
        "type": [
          "string",
          "null"
        ]
      }
    }
  },
  "template": "You are updating an existing diagnostic assessment for a distributed-systems incident.\n\nReturn the updated diagnostic response as strict JSON.\n\nDo not give a final root cause.\nGive exactly one next discriminating check.\nPreserve uncertainty when evidence is not unique.\n\nUse the JSON context as follows:\n- `problem_understanding` is the current working understanding of the incident. Update it rather than replacing it unnecessarily.\n- `resolved_observation` is the main new fact for this iteration.\n- `observations` is the structured decomposition of the new observation. Use it to update hypotheses precisely.\n- `diagnostic_state.active_hypotheses` is the current set of live hypotheses. Update this set rather than recreating unrelated hypotheses from scratch.\n- `diagnostic_state.rejected_hypotheses` contains hypotheses that were already rejected. Do not return them as active again unless the new observation provides strong contrary evidence.\n- `diagnostic_state.last_check` is the previously suggested check. Use it to avoid repeating the same next step unless repetition is clearly justified.\n- `primary_incident_card`, `incident_evidence`, and `theory_evidence` are supporting context. Use them when they help explain or discriminate between hypotheses, but do not let them override the new observation.\n- If the new observation includes a configuration, mode, or system state that materially changes diagnosis, incorporate that fact into `problem_understanding`.\n\nHypothesis identity rules:\n- If an output hypothesis is the same underlying hypothesis as one from `diagnostic_state.active_hypotheses`, preserve the same `id`.\n- Keep the same `id` even if the hypothesis text is refined, or its status or confidence changes.\n- Do not assign a new `id` to an existing hypothesis just because you rewrote its wording.\n- Do not reuse one hypothesis id for a different hypothesis.\n- If you introduce a genuinely new hypothesis, generate a new UUID string for its `id`.\n\nHypothesis-update rules:\n- The new observation must change hypothesis ranking, status, wording, or confidence when it is diagnostically meaningful.\n- Do not keep competing hypotheses at the same apparent strength if the new observation clearly favors one explanation.\n- When one hypothesis becomes the leading explanation after the new observation, explicitly weaken at least one competing hypothesis unless the observation genuinely supports both equally.\n- If an observation states a configuration, mode, or fault that is a direct mechanism for one hypothesis, explicitly strengthen that hypothesis unless stronger contrary evidence exists.\n- If an observation weakens a prior hypothesis, reflect that weakening explicitly in `status`, `confidence`, or both.\n- Prefer updating existing hypotheses over introducing new ones when the underlying explanation is the same.\n- Avoid repeating the previous hypothesis set with only cosmetic rewrites.\n\nRejected-hypothesis rules:\n- Treat `diagnostic_state.rejected_hypotheses` as already rejected diagnostic paths.\n- Do not reactivate a rejected hypothesis unless the new observation provides strong contrary evidence against the rejection.\n- If a previously rejected idea must return, represent it as a new hypothesis with a new `id` rather than reusing the old rejected hypothesis id.\n\nOutput rules:\n- `hypotheses` must contain 2 or 3 items.\n- Return the current compact hypothesis set for this iteration.\n- Each hypothesis must include `id`, `text`, `status`, `rejection_reason`, `source`, and `confidence`.\n- `status` must be one of `active`, `weakened`, or `rejected`.\n- `rejection_reason` must be non-null only when `status` is `rejected`.\n- `source` must be one of `primary_incident`, `alternative_context`, or `theory_mechanism`.\n- `confidence` must be `low`, `medium`, or `high`.\n- `text` must be a short user-facing English sentence.\n- Hypothesis text should mention the mechanism suggested by the new observation when that mechanism is explicit in the evidence.\n\nCheck-selection rules:\n- `first_check` is the next check for this iteration.\n- `first_check` must be exactly one next check, not a checklist.\n- The next check should help distinguish between plausible hypotheses or validate the leading one.\n- Prefer a check that directly tests the mechanism introduced or strengthened by the new observation.\n- Prefer naming the concrete runtime signal, metric, state, or database view to inspect, not just a broad troubleshooting goal.\n- Avoid repeating `diagnostic_state.last_check` unless repetition is clearly necessary.\n\nInterpretation rules:\n- `result_interpretation.supports_primary_if` must explain which outcome strengthens the leading explanation.\n- `result_interpretation.supports_competing_if` must explain which outcome keeps competing explanations alive.\n- `result_interpretation.inconclusive_if` may be `null`, but if used it must describe a result that still does not separate the hypotheses well.\n- In `result_interpretation`, use uncertainty-preserving language.\n- Do not write that a result `confirms the root cause`, `proves the diagnosis`, or equivalent.\n- Prefer phrases like `strengthens the leading explanation` or `keeps the competing interpretation alive`.\n- Do not swap primary and competing interpretations: evidence for replication lag must not be described as support for a weaker-consistency hypothesis, and vice versa.\n\nCompeting-interpretation rules:\n- `competing_interpretation` must describe the strongest live alternative to the leading hypothesis.\n- Do not merely restate the leading hypothesis in different words.\n- If one active hypothesis is clearly favored, `competing_interpretation` should summarize the next-best rival explanation.\n\nGeneral constraints:\n- `problem_understanding` must be written as an objective third-person technical statement describing the symptom. Do not use pronouns (you, your, I, we, your team). Example: \"The reader endpoint returns stale data that does not include writes already visible on the writer endpoint.\"\n- Do not invert visibility direction when restating reader/writer behavior. Preserve which endpoint sees the newer state and which endpoint still sees the older state.\n- The JSON must still read like a direct answer to the user.\n- Write all field values in clear English suitable for direct display.\n- Do not use internal labels or enum-like identifiers in string fields other than the required machine fields `id`, `status`, `source`, and `confidence`.\n- Do not invent evidence that is not present in the context.\n- Do not suggest destructive actions.\n- Keep the answer compact.\n\nReturn exactly one JSON object with this schema:\n{\n  \"problem_understanding\": string,\n  \"similar_practical_context\": string,\n  \"hypotheses\": [\n    {\n      \"id\": string,\n      \"text\": string,\n      \"status\": \"active|weakened|rejected\",\n      \"rejection_reason\": string | null,\n      \"source\": \"primary_incident|alternative_context|theory_mechanism\",\n      \"confidence\": \"low|medium|high\"\n    }\n  ],\n  \"firs